{
  "id": "manifest_00000000000000000000000001",
  "schema_ref": "urn:japp:schema:test-fixture:manifest:v1",
  "schema_version": "1.0.0",
  "corpus_version": "0.1.0",
  "corpus_state": "DEVELOPMENT_MUTABLE",
  "holdout_content_present": false,
  "metadata": {
    "author": "m02w01-lead-author",
    "reviewer": "m02w01-fixture-reviewer",
    "reviewed_at": "2026-07-29T08:55:00Z",
    "expected_result_provenance": "M02W01_INDEPENDENT_SYNTHETIC_REVIEW",
    "synthetic_data": true,
    "redaction_state": "SYNTHETIC_RESERVED",
    "historical_content_hash": "sha256:2d4e8c8dddd90ab7ffbc34f1f1bf65573bc2477293edf1c90272d35a5ed73774"
  },
  "files": [
    {
      "path": "evidence-artifacts.v1.json",
      "entity_type": "EVIDENCE_ARTIFACT",
      "schema_ref": "urn:japp:schema:test-fixture:evidence-artifact:v1",
      "schema_version": "1.0.0",
      "record_count": 72,
      "byte_count": 103642,
      "sha256": "sha256:10d8c1e6d7817be77ebcd95c41695eb1f4307ff67f099a10be66cf22f200da7a"
    },
    {
      "path": "expected-requirements.v1.json",
      "entity_type": "EXPECTED_REQUIREMENT",
      "schema_ref": "urn:japp:schema:test-fixture:expected-requirement:v1",
      "schema_version": "1.0.0",
      "record_count": 72,
      "byte_count": 84153,
      "sha256": "sha256:2b05481844dc1fc779cde41afe52fede20d57204680b846f93e87ed9679d51c3"
    },
    {
      "path": "expected-supported-claims.v1.json",
      "entity_type": "EXPECTED_SUPPORTED_CLAIM",
      "schema_ref": "urn:japp:schema:test-fixture:expected-supported-claim:v1",
      "schema_version": "1.0.0",
      "record_count": 59,
      "byte_count": 78082,
      "sha256": "sha256:87ec5b841dde75c19018481613285538b6bdb6ddd981e013052c911088ade6ae"
    },
    {
      "path": "field-value-policies.v1.json",
      "entity_type": "FIELD_VALUE_POLICY",
      "schema_ref": "urn:japp:schema:test-fixture:field-value-policy:v1",
      "schema_version": "1.0.0",
      "record_count": 48,
      "byte_count": 48309,
      "sha256": "sha256:5e0062e10f42920da3a3c3a12d300db306e00b72d1cc2011eb0c799e13a1ce97"
    },
    {
      "path": "jobs.v1.json",
      "entity_type": "SYNTHETIC_JOB",
      "schema_ref": "urn:japp:schema:test-fixture:synthetic-job:v1",
      "schema_version": "1.0.0",
      "record_count": 24,
      "byte_count": 45923,
      "sha256": "sha256:756c38b37f8b37392e0ce0d935135412705957d27f41f0bfed04ad74f5461b84"
    },
    {
      "path": "profiles.v1.json",
      "entity_type": "SYNTHETIC_PROFILE",
      "schema_ref": "urn:japp:schema:test-fixture:synthetic-profile:v1",
      "schema_version": "1.0.0",
      "record_count": 12,
      "byte_count": 19898,
      "sha256": "sha256:24e844a514d3d2489b1e636f65cb6d47b392226ad5877e2cc51214d643079a3d"
    },
    {
      "path": "scenario-bundles.v1.json",
      "entity_type": "SCENARIO_BUNDLE",
      "schema_ref": "urn:japp:schema:test-fixture:scenario-bundle:v1",
      "schema_version": "1.0.0",
      "record_count": 36,
      "byte_count": 66366,
      "sha256": "sha256:f9d8e59e37be312a2756810c3acea6dae4850213348e2b031416a897c1cc3115"
    },
    {
      "path": "source-resumes.v1.json",
      "entity_type": "SOURCE_RESUME",
      "schema_ref": "urn:japp:schema:test-fixture:source-resume:v1",
      "schema_version": "1.0.0",
      "record_count": 12,
      "byte_count": 30467,
      "sha256": "sha256:2bd0c6f06e286d0ff03260980d1f6cca190395a81a1190f3effc2a8de2c8331a"
    },
    {
      "path": "unsupported-gaps.v1.json",
      "entity_type": "UNSUPPORTED_GAP",
      "schema_ref": "urn:japp:schema:test-fixture:unsupported-gap:v1",
      "schema_version": "1.0.0",
      "record_count": 49,
      "byte_count": 58017,
      "sha256": "sha256:949b416235c987d8db81af6d90f9ec2333f6ee5e86b6c43f19d0320938db0909"
    }
  ],
  "counts": {
    "profiles": 12,
    "evidence_artifacts": 72,
    "source_resumes": 12,
    "jobs": 24,
    "expected_requirements": 72,
    "expected_supported_claims": 59,
    "unsupported_gaps": 49,
    "field_value_policies": 48,
    "scenario_bundles": 36,
    "scenario_evaluations": 108
  },
  "evidence_category_counts": {
    "CREDENTIAL_RECORD": 12,
    "EDUCATION_RECORD": 12,
    "EMPLOYMENT_RECORD": 24,
    "PROJECT_RECORD": 12,
    "USER_ASSERTION": 12
  },
  "role_family_counts": {
    "BUSINESS": 1,
    "DATA": 2,
    "EDUCATION": 1,
    "ENTRY_LEVEL": 2,
    "FINANCE": 1,
    "HEALTHCARE": 1,
    "OPERATIONS": 1,
    "SALES": 1,
    "SOFTWARE": 2
  },
  "corpus_digest": "sha256:d91448c44761edeaaceeef032b3fabba6729cd33dd1bb8af879fb4ffbeeb0b2f"
}
